Код|Описание
4601174112528|Самый лучший код для самых классных людей
1234567890|Второй самый лучший код для самых классных людей
4600702062687|Чистая линия. Скраб для лица очищающий (абрикосовые косточки)
4005808158003|Nivea. увлажняющий крем
3600542232012|Garnier, гиалуроновый алоэ-гель. Увлажняющий гель
4630039530832|Organic kitchen. Мягкий гель для умывания
4630039530801|Organic kitchen. Увлажняющий, успокаивающий крем
4680007214493|Organic kitchen. Маска-лифтинг для лица
4680007214530|Organic kitchen. Натуральный крем
4680007214448|Organic kitchen. Скраб ароматно-фисташковый
4630039531174|Organic kitchen. Крем для проблемной кожи лица (Укротитель строптивых)
3600540885081|Garnier. Очищающий гель для лица с щеткой с салициловой кислотой